{
  "schema_version": "1.0",
  "run_id": "2026-08-22T19-17-21.591Z_opencode_T1-repo-map",
  "status": "complete",
  "acceptance_status": "pass",
  "started_at": "2026-08-22T19:17:21.632Z",
  "finished_at": "2026-08-22T19:17:46.142Z",
  "elapsed_ms": 24510,
  "exit_code": 0,
  "signal": null,
  "timed_out": false,
  "workspace_changed": false,
  "changed_paths": [],
  "artifacts": {
    "manifest": "manifest.json",
    "prompt": "prompt.md",
    "stdout": "stdout.log",
    "stderr": "stderr.log",
    "changes": "changes.json"
  },
  "notes": []
}
